,DCT69,06/01/2025,00012.034880/2024-64,SESAPI,"Contratação de empresa especializada em serviços de natureza singular e exclusiva, visando o desenvolvimento de plataforma de gerenciamento e treinamento dos estabelecimentos assistenciais de saúde (eas) que compõem a linha de hipertensão arterial e diabetes no âmbito do programa mais saúde Piauí","SISTEMA, CONSULTORIA E SERVIÇOS DE TIC",Novo Sistema / Contratação de Pessoa Jurídica,Pregão Eletrônico,"R$ 41.370.082,96",MÁRCIO (SIA),CONCLUÍDO,ACIMA 600 MIL,26/03/2025,APROVADO,"R$ 41.370.082,96",,,,Contratação de Pessoa Jurídica,12M,CG-111,DEPOIS DO COMITÊ,,AD REFERENDUM,,,NÃO,,,EIXO ESTRATÉGICO 2 ,Desenvolvimento (Manutenção / Aperfeiçoamento ou Sustentação),,Outros serviços técnicos especializados;,SUGERE DEFERIMENTO,,SIM,,,A DEFINIR,
"Processo cancelado p/ ser contratado por operação de crédito, processo novo: sei 00012.027842/2025-36",DCT67,06/01/2025,00012.052916/2024-91,SESAPI,"Contratação de empresa especializada no rastreamento de Câncer de Pulmão (CP) e Câncer Colorretal (CCR), incluindo treinamento de profissionais da Atenção Básica, consultas e monitoramento dos pacientes nos 12 Territórios do Estado do Piauí, para atender as demandas da Secretaria de Estado da Saúde do Piauí",SISTEMA,Novo Sistema / Contratação de Pessoa Jurídica,Pregão Eletrônico,"R$ 26.100.000,00",MÁRCIO (SIA),CONCLUÍDO,ACIMA 600 MIL,26/03/2025,CANCELADO,"R$ 26.100.000,00",,,,Contratação de Pessoa Jurídica,12M,CG-111,DEPOIS DO COMITÊ,Gov pontuou que 90% desse custo é com pessoal e não com tecnologia,,,,,,,EIXO ESTRATÉGICO 2,"Licença, Desenvolvimento (Manutenção / Aperfeiçoamento ou Sustentação)",,Outros serviços técnicos especializados;,,,,,,A DEFINIR,
,DCT68,06/01/2025,00012.053833/2024-10,SESAPI,"Contratação de empresa especializada em gestão e tecnologia para a Linha de Cuidado em Psiquiatria, incluindo o treinamento de profissionais das unidades de urgência e emergência e clínica médica nos hospitais estaduais do Piauí",SISTEMA,Novo Sistema / Contratação de Pessoa Jurídica,Pregão Eletrônico,"R$ 20.400.000,00",MÁRCIO (SIA),CONCLUÍDO,ACIMA 600 MIL,17/06/2025,APROVADO,"R$ 20.400.000,00",,,,Contratação de Pessoa Jurídica,12M,CG-111,DEPOIS DO COMITÊ,,,,,,,,EIXO ESTRATÉGICO 2,"Licença, Desenvolvimento (Manutenção / Aperfeiçoamento ou Sustentação)",,Outros serviços técnicos especializados;,,,,,,A DEFINIR,
,DCT70,06/01/2025,00002.001000/2024-92,SEAD,"Contratação da ETIPI  em serviços de infraestrutura com manutenção corretiva, manutenção preventiva, desinstalações, remanejamentos e execução de implementação de rede PON (Rede Óptica Passiva) lógica e elétrica, com fornecimento de materiais, mediante contrato, conforme especificações constantes neste termo de referência.",INFRAESTRUTURA E EQUIPAMENTOS DE TIC,Comunicação de dados,Contratação Direta (Dispensa) - ETIPI,"R$ 5.853.669,66",SEAD,CONCLUÍDO,ACIMA 600 MIL,06/01/2025,APROVADO,"R$ 1.194.912,40",,,,ETIPI,3M,CG-141 ,DEPOIS DO COMITÊ,* Devolvido para redimensionamento do projeto * Foi aprovado após redimensionamento,* Devolvido para redimensionamento do projeto * Foi aprovado após redimensionamento,,,NÃO,,,EIXO TRANSVERSAL 3 ,,Infraestrutura de TIC,,AGUARDANDO REUNIÃO DO CONSELHO PARA DELIBERAÇÃO,,,,,06/01/2025,
,DCT71,07/01/2025,00027.005370/2024-11,SSP,Aquisição de uma nova licença de 4 (quatro) anos para acesso simultâneo no servidor Mercure devido a proximidade do termo final da licença já existente e a necessidade de dar continuidade aos trabalhos já realizados pela Diretoria de Inteligência Estratégica – DINTE,"SISTEMA, CONSULTORIA E SERVIÇOS DE TIC",Sistema Existente/ Licença,Contratação Direta (Inexigibilidade),"R$ 200.000,00",MÁRCIO (SIA),CONCLUÍDO,ABAIXO DE 600 MIL,NÃO SE APLICA,APROVADO,"R$ 200.000,00",,,não formalizado ,Contratação de Pessoa Jurídica,48M,CG-171,DEPOIS DO COMITÊ,,,,,NÃO,,,EIXO ESTRATÉGICO 2 - Melhoria da qualidade dos serviços públicos,Licença,,Outros serviços técnicos especializados;,,,,,,NÃO SE APLICA (ABAIXO DO VALOR MÍNIMO),
AD REFERENDUM,DCT60,14/01/2025,00117.002978/2025-65,ETIPI,"Solicitação de acréscimo de 25% ao valor do Contrato de Consumo nº 01/2024, firmado entre a ETIPI e a GWCLOUD que tem por objeto a integração dos serviços do provedor da Amazon Web Services — AWS, incluindo serviços especializados de gerenciamento, orquestração da nuvem, sustentação emergencial e administração dos projeto",CONSULTORIA E SERVIÇOS DE TIC,Serviços / Nuvem,Contratação Direta (Dispensa) - ETIPI,"R$ 2.970.048,28",NÃO SE APLICA,NÃO INICIADO,ACIMA 600 MIL,PRÓXIMA (A CONFIRMAR),APROVADO,,,,,ETIPI,12M,CG-083,DEPOIS DO COMITÊ,,,,,,,,,,,,,,,,,,
,DCT72,22/01/2025,00227.000461/2024-11,PIAUIPREV,"Aquisição de equipamentos de Tecnologia da Informação - TI, para dar continuidade aos trabalhos de modernização, expansão e organização do parque tecnológico da Fundação Piauí Previdência - PIAUIPREV, no âmbito do Programa de Sustentabilidade Fiscal, Eficiência e Eficácia do Gasto Público do Estado do Piauí – PROGESTÃO PIAUÍ.",INFRAESTRUTURA E EQUIPAMENTOS DE TIC,Equipamentos de TIC,Contratação Direta (Dispensa),"R$ 925.395,52",SEAD,CONCLUÍDO,ACIMA 600 MIL,26/03/2025,APROVADO,"R$ 925.395,52",,,15/07/2025,Contratação de Pessoa Jurídica,12M,CG-083,DEPOIS DO COMITÊ,,,,,,,,EIXO TRANSVERSAL 3,,Materiais e Equipamentos de TIC,,,,,,,A DEFINIR,
,DCT73,28/01/2025,00012.025652/2024-01,SESAPI,"Contratação de empresa especializada em serviços de consultoria técnica para implantação (planejamento, parametrização, treinamento e operação assistida) de Sistema Integrado de Gestão Hospitalar, em 25 (vinte e cinco) Unidades de Saúde que compõe a rede estadual de assistência à saúde no Estado do Piauí, incluindo a transferência de know how para a equipe de sustentabilidade da SESAPI",CONSULTORIA E SERVIÇOS DE TIC,Serviços / Outros Serviços Especializados,Contratação Direta (Inexigibilidade),"R$ 6.000.000,00",MÁRCIO (SIA),CONCLUÍDO,ACIMA 600 MIL,17/06/2025,APROVADO,"R$ 6.000.000,00",,,,Contratação de Pessoa Jurídica,12M,CG-111,DEPOIS DO COMITÊ,,,,,,,,EIXO ESTRATÉGICO 2,,,Outros serviços técnicos especializados;,,,,,,A DEFINIR,
,DCT74,13/02/2025,00012.025075/2024-40,SESAPI,"Contratação de empresa especializada em telecomunicações, que possuam outorga da Agência Nacional de Telecomunicações-ANATEL, para prestação de serviços de Telefonia Fixa Comutada, na modalidade Local, Serviço Telefônico Comutado de Longa Distância Nacional – LDN e Longa Distância Internacional – LDI (tecnologia E1), originários de terminais fixos, para atender as demandas da Secretaria de Estado da Saúde do Piauí.",INFRAESTRUTURA E EQUIPAMENTOS DE TIC,Comunicação de dados,Adesão à Ata de Registro de Preços,"R$ 606.670,92",MÁRCIO (SIA),CONCLUÍDO,ACIMA 600 MIL,26/03/2025,APROVADO,"R$ 606.670,92",,"R$ 90.030,45",01/04/2025,Contratação de Pessoa Jurídica,12M,CG-111,DEPOIS DO COMITÊ,,AD REFERENDUM,,,NÃO,,,EIXO ESTRATÉGICO 2 ,,Comunicação de Dados,,AGUARDANDO REUNIÃO DO CONSELHO PARA DELIBERAÇÃO,,,,,A DEFINIR,
,DCT75,19/02/2025,00022.001983/2024-29,SECULT,Contratação de empresa especializada na prestação do serviço de locação de impressoras,CONSULTORIA E SERVIÇOS DE TIC,Serviços / Outsourcing de Impressão,Contratação Direta (Dispensa) - ETIPI,"R$ 229.788,00",ETIPI,CONCLUÍDO,ABAIXO DE 600 MIL,NÃO SE APLICA,REJEITADO,,,,,ETIPI,12M,CG-141 ,DEPOIS DO COMITÊ,,,,,,,,EIXO TRANSVERSAL 3,,,Impressão e digitalização;,,,,,,NÃO SE APLICA (ABAIXO DO VALOR MÍNIMO),
,DCT75,25/02/2025,00002.003075/2024-16,SEAD,Contratação de empresa especializada em Desenvolvimento de Dashboard e Consultoria de Análise de Dados do Sistema Eletrônico de Informações – SEI do Governo do Estado do Piauí.,SISTEMA,Sistema Existente / Fábrica Software,Contratação Direta (Dispensa),"R$ 58.870,00",SEAD,CONCLUÍDO,ABAIXO DE 600 MIL,NÃO SE APLICA,APROVADO,"R$ 58.870,00",,,,Fábrica de Software,12M,NÃO,DEPOIS DO COMITÊ,,,,,,,,EIXO TRANSVERSAL 3,Desenvolvimento (Manutenção / Aperfeiçoamento ou Sustentação),,,,finalizado,APROVADO,,,SEAD,
,DCT71,06/03/2025,00017.000422/2025-62,SEPLAN,"contratação de empresa para o fornecimento de equipamentos de informática (microcomputadores, monitores e filtros de linha) para a SEPLAN",INFRAESTRUTURA E EQUIPAMENTOS DE TIC,Equipamentos de TIC,"Operação de Crédito (BID, BIRD, etc)","R$ 578.297,89",MÁRCIO (SIA),CONCLUÍDO,ABAIXO DE 600 MIL,NÃO SE APLICA,APROVADO,"R$ 578.297,89",,"R$ 551.564,00",08/05/2025,Contratação de Pessoa Jurídica,ÚNICA,CG-141 ,DEPOIS DO COMITÊ,,,,,,,,EIXO TRANSVERSAL 3,,Materiais e Equipamentos de TIC,,,,,,,,
,DCT73,06/03/2025,00015.000534/2025-33,GAMIL,Aquisição de 4 Transceptor Portátil Aeronáutico,INFRAESTRUTURA E EQUIPAMENTOS DE TIC,Outros Equipamentos,Adesão à Ata de Registro de Preços,"R$ 120.480,00",MÁRCIO (SIA),CONCLUÍDO,ABAIXO DE 600 MIL,NÃO SE APLICA,APROVADO,"R$ 120.480,00",,,,Contratação de Pessoa Jurídica,12M,CG-171,DEPOIS DO COMITÊ,,,,,,,,EIXO ESTRATÉGICO 2 - Melhoria da qualidade dos serviços públicos,,"Materiais e Equipamentos de TIC, Infraestrutura de TIC",,,,,,,,
,DCT72,06/03/2025,00071.005402/2024-42,INTERPI,Contratação de pessoa jurídica especializada no fornecimento de aparelhos de informática do tipo tablet.,INFRAESTRUTURA E EQUIPAMENTOS DE TIC,Equipamentos de TIC,Contratação Direta (Dispensa),"R$ 119.550,00",SEAD,CONCLUÍDO,ABAIXO DE 600 MIL,NÃO SE APLICA,APROVADO,"R$ 119.550,00",,,não formalizado,Contratação de Pessoa Jurídica,12M,CG-141 ,DEPOIS DO COMITÊ,,,,,,,,,,"Materiais e Equipamentos de TIC, Infraestrutura de TIC",,,,,,,,
,DCT74,06/03/2025,00015.000442/2025-53,GAMIL,Aquisição de 08 (oito) microcomputadores do tipo tablet para atender às necessidades administrativas e operacionais do Gabinete Militar,INFRAESTRUTURA E EQUIPAMENTOS DE TIC,Equipamentos de TIC,Adesão à Ata de Registro de Preços,"R$ 24.720,00",SEAD,CONCLUÍDO,ABAIXO DE 600 MIL,NÃO SE APLICA,APROVADO,"R$ 24.720,00",,,,Contratação de Pessoa Jurídica,12M,CG-141 ,DEPOIS DO COMITÊ,,,,,,,,EIXO TRANSVERSAL 3,,"Materiais e Equipamentos de TIC, Infraestrutura de TIC",,,,,,,,
,DCT75,13/03/2025,00153.000094/2025-30,SETUR,Aquisições de equipamentos de informática por meio de Adesão a Ata de Registro de Preço,INFRAESTRUTURA E EQUIPAMENTOS DE TIC,Equipamentos de TIC,Adesão à Ata de Registro de Preços,"R$ 7.705,23",SEAD,CONCLUÍDO,ABAIXO DE 600 MIL,NÃO SE APLICA,APROVADO,"R$ 7.705,23",,,não formalizado,Contratação de Pessoa Jurídica,12M,NÃO,DEPOIS DO COMITÊ,,,,,,,,EIXO TRANSVERSAL 3 ,,"Materiais e Equipamentos de TIC, Infraestrutura de TIC",,,,,,,,
,DCT76,17/03/2025,00002.009021/2024-56,SEAD,"Contratação de serviços de natureza continuada para fornecimento de sistemas e suporte especializado em gestão tecnológica do eSocial, soluções na operacionalização, monitoramento e auditoria dos dados enviados para base de dados do eSocial","SISTEMA, CONSULTORIA E SERVIÇOS DE TIC",Sistema Existente/ Licença,Contratação Direta (Inexigibilidade),"R$ 7.142.200,00",SEAD,CONCLUÍDO,ACIMA 600 MIL,14/10/2025,APROVADO,,,,,Contratação de Pessoa Jurídica,12M,NÃO,DEPOIS DO COMITÊ,Gov pediu para ouvir mais gente. Encaminhar para Sefaz/CGE fazer uma avaliação de custos e viabilidade. Foi perguntado ao Sec Sead pq a Vobys não faz isso e ele explicou o motivo. ,,,,,,,EIXO TRANSVERSAL 3 ,Licença,,"Outras consultorias especializadas em TIC;, ""Consultoria em Análise de Dados, Aprendizado de Máquina e inteligência Artificial;""",,,,,,,
,DCT77,19/03/2025,00345.000528/2024-63,SERES,Adesão de Ata para compra de 2 TV smart,INFRAESTRUTURA E EQUIPAMENTOS DE TIC,Outros Equipamentos,Adesão à Ata de Registro de Preços,"R$ 7.280,00",MÁRCIO (SIA),CONCLUÍDO,ABAIXO DE 600 MIL,NÃO SE APLICA,APROVADO,"R$ 7.280,00",,"R$ 7.280,00",14/03/2025,Contratação de Pessoa Jurídica,12M,CG-081,DEPOIS DO COMITÊ,,,,,,,,EIXO TRANSVERSAL 3 ,,"Materiais e Equipamentos de TIC, Infraestrutura de TIC",,,,,,,,
,DCT78,21/03/2025,00002.002300/2025-70,SEAD,Contratação da Piauí Link,INFRAESTRUTURA E EQUIPAMENTOS DE TIC,Comunicação de dados,Contratação Direta (Dispensa),"R$ 42.030.720,00",SEAD,CONCLUÍDO,ACIMA 600 MIL,26/03/2025,APROVADO,"R$ 42.030.720,00",,,,Contratação de Pessoa Jurídica,12M,NÃO,DEPOIS DO COMITÊ,,,,,,,,EIXO TRANSVERSAL 3 ,,Comunicação de Dados,,,,,,,,
,DCT79,25/03/2025,00089.026908/2024-04,UESPI,Aquisição de Maquina Termográfica para o laboratórios  do curso de educação física localizado no Núcleo de Biotecnologia e Biodiversidade,INFRAESTRUTURA E EQUIPAMENTOS DE TIC,Outros Equipamentos,Contratação Direta (Inexigibilidade),"R$ 89.625,99",SEAD,CONCLUÍDO,ABAIXO DE 600 MIL,NÃO SE APLICA,APROVADO,"R$ 89.625,99",,,não formalizado,Contratação de Pessoa Jurídica,12M,NÃO,DEPOIS DO COMITÊ,,,,,,,,NÃO,,Materiais e Equipamentos Diversos,,,,,,,,
,DCT83,26/03/2025,00240.000368/2024-21,SADA,"Contratação de solução tecnológica integrada de monitoramento digital, abrangendo o desenvolvimento, implantação e manutenção de sistema web e aplicativo mobile para a Secretaria da Assistência Técnica e Defesa Agropecuária do Piauí (SADA-PI), incluindo serviços de suporte técnico mensal, manutenção preventiva, corretiva e evolutiva, capacitação de usuários e entrega do código-fonte da solução.",SISTEMA,Novo Sistema / ETIPI,Contratação Direta (Dispensa) - ETIPI,"R$ 1.916.500,00",ETIPI,CONCLUÍDO,ACIMA 600 MIL,26/03/2025,APROVADO,"R$ 1.916.500,00",,,não formalizado,ETIPI,12M,NÃO,DEPOIS DO COMITÊ,,,,,,,,EIXO TRANSVERSAL 3,"Desenvolvimento (Manutenção / Aperfeiçoamento ou Sustentação), Desenvolvimento (Novo Sistema)",,,,,,,,,
Vide observação.,DCT80,28/03/2025,00027.009359/2024-20,SSP,"Aquisição de equipamentos de informática, para implantação de unidades de serviços de coleta de digitais em recém-nascidos nas 15 maternidades estaduais, para emissão carteira de identidade nacional. ",INFRAESTRUTURA E EQUIPAMENTOS DE TIC,Outros Equipamentos,Contratação Direta (Inexigibilidade),"R$ 1.156.270,50",MÁRCIO (SIA),CONCLUÍDO,ACIMA 600 MIL,17/06/2025,APROVADO,"R$ 1.156.270,50",,"R$ 1.156.270,50",,Contratação de Pessoa Jurídica,12M,CG-171,DEPOIS DO COMITÊ,,"Foi criado processo com o mesmo objeto (00027.002293/2025-28) e enviado para aprovação. Na ocasião, registrou-se a redução do valor do equipamento, que passou de R$ 70.000,00 para R$ 59.000,00 (valores aproximados).
Processo foi devolvido  sem nova análise.",,,,,,EIXO ESTRATÉGICO 2,,"Materiais e Equipamentos de TIC, Materiais e Equipamentos Diversos",,,,,,,,
,DCT81,28/03/2025,00024.000456/2024-87,SASC,"a aquisição de equipamentos de informática e periféricos, para atender a nova sede da SASC/SUPERINTENDENCIAS",INFRAESTRUTURA E EQUIPAMENTOS DE TIC,Equipamentos de TIC,Contratação Direta (Dispensa),"R$ 56.463,58",SEAD,CONCLUÍDO,ABAIXO DE 600 MIL,NÃO SE APLICA,APROVADO,"R$ 56.463,58",,,,Contratação de Pessoa Jurídica,12M,?,DEPOIS DO COMITÊ,,,,,,,,Avançar em Políticas de Transformação Digital.,,Infraestrutura de TIC,,,,,,,,
,DCT84,28/03/2025,00110.000198/2024-60,FAPEPI,contratação de empresa especializada para a prestação mensal do Serviço Telefônico Fixo Comutado (STFC),INFRAESTRUTURA E EQUIPAMENTOS DE TIC,Comunicação de dados,Adesão à Ata de Registro de Preços,"R$ 14.674,25",SEAD,CONCLUÍDO,ABAIXO DE 600 MIL,NÃO SE APLICA,APROVADO,"R$ 14.674,25",,,não formalizado,Contratação de Pessoa Jurídica,12M,CG-081,DEPOIS DO COMITÊ,,,,,,,,EIXO TRANSVERSAL 3,,Materiais e Equipamentos Diversos,,,,,,,,
,DCT85,01/04/2025,00012.011376/2024-96,SESAPI,"Contratação de uma plataforma de gestão de ativos, abrangendo o monitoramento de manutenções preventivas e corretivas, bem como a gestão de frota de veículos, para a Secretaria de Estado da Saúde do Piauí (SESAPI)",SISTEMA,Novo Sistema / ETIPI,Contratação Direta (Dispensa) - ETIPI,"R$ 2.453.000,00",SEAD,CONCLUÍDO,ACIMA 600 MIL,10/05/2024,APROVADO,"R$ 2.453.000,00",,"R$ 2.453.000,00",22/05/2025,ETIPI,12M,CG-111,DEPOIS DO COMITÊ,,,,,,,,EIXO ESTRATÉGICO 2,Desenvolvimento (Novo Sistema),,,,,,,,,
,DCT86,01/04/2025,00031.000260/2024-01,JUCEPI,"Trata-se de solicitação da JUCEPI para acrescimo de objeto no Contrato n° 003/2021 com a empres VOX Soluções Tecnológicas Ltda. O pedido inclusi novas funcionalidades no sistema integrador, como módulos agropecuários, BI e chatbot, além de aumento na capacidade do Data Center. ",SISTEMA,Sistema Existente / Contratação de Pessoa Jurídica,Não se aplica (Renovação),"R$ 273.821,40",ETIPI,CONCLUÍDO,ABAIXO DE 600 MIL,NÃO SE APLICA,APROVADO,,,,,Contratação de Pessoa Jurídica,12M,CG-081,DEPOIS DO COMITÊ,,,,,,,,EIXO TRANSVERSAL 3,Desenvolvimento (Manutenção / Aperfeiçoamento ou Sustentação),,,,,,,,,
,DCT87,01/04/2025,00089.016250/2023-33,UESPI,Aquisição de 02 (duas) lousas digitais,INFRAESTRUTURA E EQUIPAMENTOS DE TIC,Outros Equipamentos,Pregão Eletrônico,"R$ 79.492,00",ETIPI,CONCLUÍDO,ABAIXO DE 600 MIL,NÃO SE APLICA,APROVADO,"R$ 79.492,00",,,não formalizado,Contratação de Pessoa Jurídica,12M,CG-007,DEPOIS DO COMITÊ,,,,,,,,EIXO ESTRATÉGICO 2,,Materiais e Equipamentos Diversos,,,,,,,,
,DCT87,04/04/2025,00002.000766/2025-31,SEAD,contratação de consultoria especializada para o desenvolvimento e implementação de uma solução tecnológica com uso de Inteligência Artificial (IA) destinada à modernização da gestão e ao fortalecimento da governança da folha de pagamento dos servidores públicos do Estado do Piauí.,"SISTEMA, INFRAESTRUTURA E EQUIPAMENTOS DE TIC, CONSULTORIA E SERVIÇOS DE TIC",Consultoria / Inteligência Artificial,"Operação de Crédito (BID, BIRD, etc)","R$ 12.377.959,92",SEAD,CONCLUÍDO,ACIMA 600 MIL,17/06/2025,APROVADO,"R$ 12.377.959,92",,,,Contratação de Pessoa Jurídica,12M,NÃO,DEPOIS DO COMITÊ,,,,,,,,"Transformação Digital – Choque de Digitalização”, “Eficiência/Resultados” e “Estabilidade Fiscal”​.",Desenvolvimento (Novo Sistema),"Computação em Nuvem, Hospedagem de Sistemas, Suporte e Atendimento a Usuário de TIC, Segurança da Informação e Privacidade",Outras consultorias especializadas em TIC;,,,,,,,
,DCT88,04/04/2025,00002.008957/2024-60,SEAD,"contratação de bens, através do Pró-gestão, com vistas à aquisição de 20 (vinte) pares de receptores GNSS L1/L2 RTK, 15 (quinze) receptores GPS de navegação portátil, 04 (quatro) aeronaves remotamente pilotada (drone com hélices) com sistema RTK integrado e 01 (um) sistema GNSS com ativação por assinatura, composto dos seguintes itens: Receptor GNSS, Coletor de Dados, assinatura de Software para Coleta de Dados e assinatura de Correção Diferencial via satélite e demais acessórios, para atender às necessidades desta superintendência, conforme especificações em anexo na Especificação Técnica elaborada pela equipe desta SPI.",INFRAESTRUTURA E EQUIPAMENTOS DE TIC,Outros Equipamentos,"Operação de Crédito (BID, BIRD, etc)","R$ 2.965.773,40",SEAD,CONCLUÍDO,ACIMA 600 MIL,17/06/2025,APROVADO,"R$ 2.965.773,40",,,,Contratação de Pessoa Jurídica,12M,CG-081,DEPOIS DO COMITÊ,,,,,,,,EIXO TRANSVERSAL 3,,Materiais e Equipamentos Diversos,,,,,,,,
,DCT92,04/04/2025,00017.000717/2025-39,SEPLAN,Solicitação de Equipamentos de WiFi para a DITI,INFRAESTRUTURA E EQUIPAMENTOS DE TIC,Equipamentos de TIC,Contratação Direta (Dispensa),"R$ 52.077,67",SEAD,CONCLUÍDO,ABAIXO DE 600 MIL,NÃO SE APLICA,APROVADO,"R$ 52.077,67",,"R$ 49.855,00",14/04/2025,Contratação de Pessoa Jurídica,3M,CG-141,DEPOIS DO COMITÊ,,,,,,,,EIXO TRANSVERSAL 3,,"Materiais e Equipamentos de TIC, Infraestrutura de TIC",,,,,,,,
,DCT91,04/04/2025,00003.001242/2025-57,PGE,Contratação da Plataforma Jusbrasil para a Procuradoria-Geral do Estado do Piauí,SISTEMA,Sistema Existente/ Assinatura,Contratação Direta (Inexigibilidade),"R$ 25.444,80",ETIPI,CONCLUÍDO,ABAIXO DE 600 MIL,NÃO SE APLICA,APROVADO,"R$ 25.444,80",,,,Contratação de Pessoa Jurídica,12M,CG-081,DEPOIS DO COMITÊ,,,,,,,,EIXO TRANSVERSAL 3,Assinatura,,,,,,,,,
Seguiu sem aprovação,DCT93,07/04/2025,00009.024448/2024-14,SEFAZ,"Contratação de serviço de compartilhamento de dados de cadastro disponibilizados pelo SERPRO, direto de suas bases através da plataforma do b-Cadastro, para otimizar consultas de dados de CPF e CNPJ de contribuintes, para atender as necessidades da continuidade dos serviços do ambiente Hadoop",SISTEMA,Sistema Existente/ Assinatura,Contratação Direta (Inexigibilidade),"R$ 45.164,70",ETIPI,CONCLUÍDO,ABAIXO DE 600 MIL,NÃO SE APLICA,NÃO SE APLICA ,,,"R$ 45.164,70",25/04/2025,SERPRO,12M,CG-081,DEPOIS DO COMITÊ,,,,,NÃO,,,EIXO TRANSVERSAL 3,Assinatura,,,,,,,,,
Ver com o secretário o encaminhamento,DCT95,08/04/2025,00003.000571/2025-81,PGE,disponibilização de 03 (três) profissionais aprovados na área de Especialista em Análise e Desenvolvimento de Sistemas (Desenvolvedor Full Stack) para que possam integrar temporariamente a equipe do NIT da PGE-PI.,CONSULTORIA E SERVIÇOS DE TIC,Serviços / Outros Serviços Especializados,Não se aplica (Cessão de Pessoal de TI),"R$ 466.560,00",MÁRCIO (SIA),CONCLUÍDO,ABAIXO DE 600 MIL,PRÓXIMA (A CONFIRMAR),CANCELADO,,,,,ETIPI,12M,CG-081,DEPOIS DO COMITÊ,,,,,,,,,,,,,,,,,,
Ver com o secretário o encaminhamento,DCT94,08/04/2025,00017.000183/2025-41,SEPLAN,"Solicita profissional especialista em Infraestrutura e Redes de Computadores, aprovado no processo seletivo realizado pela ETIPI em 2023, para atuar junto à Diretoria de Tecnologia e Inovação (DITI) desta Secretaria.",CONSULTORIA E SERVIÇOS DE TIC,Serviços / Outros Serviços Especializados,Não se aplica (Cessão de Pessoal de TI),"R$ 155.520,00",MÁRCIO (SIA),CONCLUÍDO,ABAIXO DE 600 MIL,PRÓXIMA (A CONFIRMAR),CANCELADO,,,,,ETIPI,12M,CG-081,DEPOIS DO COMITÊ,,,,,,,,,,,,,,,,,,
,DCT96,16/04/2025,00027.000559/2025-06,SSP,"contratação de empresa para realizar o desenvolvimento do novo site institucional da Secretaria de Segurança Pública do Piauí, com o objetivo de modernizar e otimizar a comunicação entre a SSP-PI e a população.",SISTEMA,Novo Sistema / Contratação de Pessoa Jurídica,Contratação Direta (Dispensa),"R$ 57.200,00",MÁRCIO (SIA),CONCLUÍDO,ABAIXO DE 600 MIL,NÃO SE APLICA,APROVADO,"R$ 57.200,00",,"R$ 55.900,00",,Contratação de Pessoa Jurídica,12M,CG-171,DEPOIS DO COMITÊ,,,,,,,,EIXO ESTRATÉGICO 2,Desenvolvimento (Novo Sistema),,,,,,,,,
,DCT97,22/04/2025,00031.000088/2025-69,JUCEPI,Aquisição e contratação de empresa especializada para a implantação de uma Sala de Multimídia na Sala de Plenário de Vogais da JUCEPI.,INFRAESTRUTURA E EQUIPAMENTOS DE TIC,Outros Equipamentos,Adesão à Ata de Registro de Preços,"R$ 668.852,28",ETIPI,CONCLUÍDO,ACIMA 600 MIL,14/10/2025,APROVADO,,,,,Contratação de Pessoa Jurídica,12M,CG-084,DEPOIS DO COMITÊ,,,,,,,,EIXO ESTRATÉGICO 1,,"Materiais e Equipamentos de TIC, Materiais e Equipamentos Diversos",,,,,,,,
Seguiu sem aprovação,DCT98,22/04/2025,00031.000170/2025-93,JUCEPI,Aquisição de equipamentos de informática.,INFRAESTRUTURA E EQUIPAMENTOS DE TIC,Equipamentos de TIC,Adesão à Ata de Registro de Preços,"R$ 168.988,09",SEAD,CONCLUÍDO,ABAIXO DE 600 MIL,NÃO SE APLICA,NÃO SE APLICA ,,,,,Contratação de Pessoa Jurídica,12M,CG-084,DEPOIS DO COMITÊ,,,,,NÃO,,,EIXO ESTRATÉGICO 1,,"Materiais e Equipamentos de TIC, Materiais e Equipamentos Diversos",,,,,,,,
Seguiu sem aprovação,DCT99,24/04/2025,00031.000074/2025-45,JUCEPI,Solicitar a emissão de parecer técnico quanto à viabilidade da prorrogação do prazo de Vigência Contratual do contrato n.º 003/2021 que tem por objeto os serviços relacionados à manutenção da Rede Nacional para a Simplificação do Registro e da Legalização de Empresas e Negócios (REDESIM) no Estado do Piauí.,SISTEMA,Sistema Existente / Contratação de Pessoa Jurídica,Não se aplica (Renovação),"R$ 653.257,08",ETIPI,CONCLUÍDO,ACIMA 600 MIL,NÃO SE APLICA,APROVADO,,,"R$ 1.119.869,28",15/05/2025,Contratação de Pessoa Jurídica,12M,CG-084,DEPOIS DO COMITÊ,,,,,SIM,,,EIXO ESTRATÉGICO 1,,,,,,,,,,
Retirado da Pauta do dia 17/06. Verificar com o Secretario se o processo ainda tem viabilidade ,DCT100,28/04/2025,00309.004212/2024-87,ADAPI,"Contratação de serviços de otimização dos processos da adapi, visando o desenvolvimento de um modelo de gestão de desempenho para potencializar a eficiência operacional através da automação e profissionalização da gestão pública.",CONSULTORIA E SERVIÇOS DE TIC,Serviços / Outros Serviços Especializados,Contratação Direta (Dispensa) - FADEX,"R$ 2.512.629,19",SEAD,CONCLUÍDO,ACIMA 600 MIL,PRÓXIMA (A CONFIRMAR),AINDA NÃO SUBMETIDO,,,,,FADEX,12M,CG-084,DEPOIS DO COMITÊ,,,,,NÃO,,,EIXO ESTRATÉGICO 1,,,Outros serviços técnicos especializados;,,,,,,,
Seguiu sem aprovação,DCT102,06/05/2025,00031.000260/2025-84,JUCEPI,"Autorização para a prorrogação de vigência contratual  com a empresa Lima Júnior Comércio e Serviços de Informática, cujo objeto é a prestação de serviços de locação de 06(seis) Impressoras Multifuncional laser monocromática",CONSULTORIA E SERVIÇOS DE TIC,Serviços / Outsourcing de Impressão,Não se aplica (Renovação),"R$ 21.600,00",ETIPI,CONCLUÍDO,ABAIXO DE 600 MIL,NÃO SE APLICA,NÃO SE APLICA ,,,"R$ 21.600,00",01/07/2025,Contratação de Pessoa Jurídica,12M,CG-084,DEPOIS DO COMITÊ,,,,,SIM,,,EIXO ESTRATÉGICO 1,,,,,,,,,,
