,DCT103,16/05/2025,00009.001202/2025-55,SEFAZ,"Contratação de serviços de mensageria (SMS e Whatsapp Business) e de nuvem particular para uso de Inteligência Artificial Generativa, nos termos da tabela abaixo, conforme condições e exigências estabelecidas neste documento.",CONSULTORIA E SERVIÇOS DE TIC,Serviços / Outros Serviços Especializados,Contratação Direta (Dispensa),"R$ 626.600,00",EQUIPE (SIA),CONCLUÍDO,ACIMA 600 MIL,17/06/2025,APROVADO,"R$ 626.600,00",,"R$ 490.998,78",,Contratação de Pessoa Jurídica,12M,CG-083,DEPOIS DO COMITÊ,,,,,NÃO,,,EIXO TRANSVERSAL 3 ,,,,,,,,,,
,DCT104,30/05/2025,00009.009220/2024-02,SEFAZ,"Contratação de empresa para aquisição de Licença de Software de Design Gráfico e seus aplicativos (Adobe Creative Cloud All Apps) por 36(trinta e seis) meses, para atender a demanda da ASCOM em desenvolver projetos de divulgação dos atos e eventos da SEFAZ/PI",SISTEMA,Novo Sistema / Licença,Contratação Direta (Dispensa),"R$ 16.169,00",SEAD,CONCLUÍDO,ABAIXO DE 600 MIL,NÃO SE APLICA,APROVADO,,,,,Contratação de Pessoa Jurídica,36M,CG-125 ,DEPOIS DO COMITÊ,,,,,,,,,,,,,,,,,,
,DCT106,04/06/2025,00027.000095/2025-20,SSP,"Contratação de solução integrada visando a captação, transmissão, armazenamento, gestão e custódia de evidências digitais obtidas por câmeras corporais operacionais (CCO) ou bodycams nas atividades das instituições que compõem a Secretaria da Segurança Pública (SSP/PI)",SISTEMA,Novo Sistema / Contratação de Pessoa Jurídica,Pregão Eletrônico,"R$ 8.635.248,00",EQUIPE (SIA),CONCLUÍDO,ACIMA 600 MIL,17/06/2025,APROVADO,"R$ 8.635.248,00",,,,Contratação de Pessoa Jurídica,12M,CG-171,DEPOIS DO COMITÊ,,,,,NÃO,,,EIXO ESTRATÉGICO 2,,,,,,,,,,
,DCT107,05/06/2025,00011.026130/2025-18,SEDUC,"Contratação de serviços comuns de natureza contínua e de execução indireta por preço global de empresa especializada para produção e operacionalização do Programa de Mediação Tecnológica da Rede Pública de Ensino Estadual (Canal Educação), incluindo serviços técnicos para a produção de aulas a partir do Centro de Mídias, abrangendo infraestrutura tecnológica, operação, suporte técnico e treinamento",CONSULTORIA E SERVIÇOS DE TIC,Serviços / Outros Serviços Especializados,Pregão Eletrônico,"R$ 71.284.547,57",MÁRCIO (SIA),CONCLUÍDO,ACIMA 600 MIL,17/06/2025,APROVADO,"R$ 71.284.547,57",,,,Contratação de Pessoa Jurídica,12M,CG-075,DEPOIS DO COMITÊ,,,,,NÃO,,,EIXO ESTRATÉGICO 2,,,,,,,,,,
,DCT108,10/06/2025,00009.005294/2025-42,SEFAZ,Contratação da licença do Sistema Banco de Preços,SISTEMA,Sistema Existente/ Assinatura,Contratação Direta (Inexigibilidade),"R$ 36.900,00",MÁRCIO (SIA),CONCLUÍDO,ABAIXO DE 600 MIL,NÃO SE APLICA,APROVADO,,,,,Contratação de Pessoa Jurídica,12M,CG-059,DEPOIS DO COMITÊ,,,,,,,,,,,,,,,,,,
,DCT109,13/06/2025,00030.007149/2025-29,DETRAN,"Desenvolvimento e manutençãodesoftware para o ambiente de TI abrangendo arquiteturas web, mobileecliente servidor, cumulada com oferta de garantia e atualização técnica",SISTEMA,Sistema Existente / Contratação de Pessoa Jurídica,Não se aplica (Renovação),"R$ 3.600.000,00",MÁRCIO (SIA),CONCLUÍDO,ACIMA 600 MIL,17/06/2025,APROVADO,"R$ 3.600.000,00",,"R$ 3.420.000,00",22/07/2025,Contratação de Pessoa Jurídica,12M,CG-005,DEPOIS DO COMITÊ,,,,,,,,,,,,,,,,,,
,DCT110,13/06/2025,00030.018934/2025-15,DETRAN,"Contratação, por meio de pregão eletrônico, de empresa especializada para a disponibilização de plataforma tecnológica destinada à gestão, controle e auditoria das aulas práticas de direção veicular na categoria “A”, ministradas a candidatos beneficiários do Programa CNH Social Estudantil, instituído pela Lei Estadual nº 8.674, de 07 de maio de 2025",SISTEMA,Novo Sistema / Contratação de Pessoa Jurídica,Pregão Eletrônico,"R$ 2.160.000,00",ETIPI,CONCLUÍDO,ACIMA 600 MIL,17/06/2025,APROVADO,"R$ 2.160.000,00",,,não formalizado,Contratação de Pessoa Jurídica,12M,CG-005,DEPOIS DO COMITÊ,,,,,,,,,,,,,,,,,,
,DCT113,14/07/2025,00027.007972/2024-11,SSP,Aquisição de equipamentos de informática para integrar as estações de trabalho na infraestrutura física do Núcleo de Estudos avançados em Segurança Pública – DATASSP,INFRAESTRUTURA E EQUIPAMENTOS DE TIC,Equipamentos de TIC,Adesão à Ata de Registro de Preços,"R$ 1.080.160,26",SEAD,CONCLUÍDO,ACIMA 600 MIL,14/10/2025,APROVADO,,,,,Contratação de Pessoa Jurídica,12M,CG-083,DEPOIS DO COMITÊ,,,,,,,,,,,,,,,,,,
,DCT114,21/07/2025,00147.000783/2024-42,SSP,"Contratações de encomendas tecnológicas referentes a: 1)  contratação de serviços para desenvolvimento de um projeto de análise e interpretação de dados relacionados às ações das forças de Segurança Pública do Estado do Piauí. 2) contratação de serviços para o desenvolvimento de solução voltada à automatização da coleta e análise de informações sobre recursos humanos e equipamentos da Secretaria de Segurança Pública do Estado do Piauí, possibilitando melhor gestão e alocação destes recursos; e 3) contratação de serviços para o desenvolvimento de solução baseada em Inteligência Artificial (IA) e Processamento de Linguagem Natural (PLN) para automatização da análise de dados textuais dos Boletins de Ocorrência, detecção de padrões criminais e desenvolvimento de chatbot para comunicação com a sociedade;","SISTEMA, CONSULTORIA E SERVIÇOS DE TIC",Consultoria / Inteligência Artificial,Encomenda Tecnológica,"R$ 98.280,00",EQUIPE (SIA),CONCLUÍDO,ABAIXO DE 600 MIL,NÃO SE APLICA,APROVADO,,,#N/A,,Contratação de Pessoa Jurídica,12M,CG-171,DEPOIS DO COMITÊ,,Contratação via Encomenda Tecnológica,,,,,,,,,,,,,,,,
Enviado para deliberação,DCT115,24/07/2025,00089.010656/2025-74,UESPI,Aquisição de Licença Perpétua do Microsoft Office Home & Student 2021.,SISTEMA,Sistema Existente/ Licença,Pregão Eletrônico,"R$ 16.661,43",ETIPI,CONCLUÍDO,ABAIXO DE 600 MIL,NÃO SE APLICA,AINDA NÃO SUBMETIDO,,,#N/A,,Contratação de Pessoa Jurídica,12M,CG-007,DEPOIS DO COMITÊ,,,,,,,,,,,,,,,,,,
Enviado para deliberação,DCT117,28/07/2025,00027.001730/2025-96,SSP,"Aquisição de Notebooks para implantação de unidades de serviços de coleta de digitais em recém nascidos nas 15 maternidades estaduais, para emissão carteira de identidade nacional",INFRAESTRUTURA E EQUIPAMENTOS DE TIC,Equipamentos de TIC,Adesão à Ata de Registro de Preços,"R$ 111.360,00",EQUIPE (SIA),CONCLUÍDO,ABAIXO DE 600 MIL,NÃO SE APLICA,AINDA NÃO SUBMETIDO,,,#N/A,,Contratação de Pessoa Jurídica,12M,CG-171,DEPOIS DO COMITÊ,,,,,,,,,,,,,,,,,,
,DCT116,28/07/2025,00240.002053/2025-07,SADA,"Aquisição de licenciamento de software da Gestão Administrativa para o Banco de Alimentos da CEASA/PI, no contexto do Contrato de repasse N° 970983 (SEI nº 018852079) firmado com o Ministério do Desenvolvimento e Assistência Social, Família e Combate à Fome",SISTEMA,Novo Sistema / Licença,Convênio Federal,"R$ 10.050,00",SEAD,CONCLUÍDO,ABAIXO DE 600 MIL,NÃO SE APLICA,AINDA NÃO SUBMETIDO,,,#N/A,,Contratação de Pessoa Jurídica,12M,CG-128,DEPOIS DO COMITÊ,,,,,,,,,,,,,,,,,,
"Como não vai ter incremento de valor, não precisa de nova manifestação do CTD",DCT119,30/07/2025,00012.013830/2025-24,SESAPI,"Solicitação de prorrogação do Contrato nº 523/2024, com vigência até 29/07/2025 (contratação de uma solução integrada para implantação de software de gestão de saúde, para atender as necessidades da Secretaria de Estado da Saúde)",SISTEMA,Sistema Existente / Contratação de Pessoa Jurídica,Não se aplica (Renovação),"R$ 54.150.000,00",NÃO SE APLICA,NÃO INICIADO,ACIMA 600 MIL,PRÓXIMA (A CONFIRMAR),CANCELADO,,,#N/A,,Contratação de Pessoa Jurídica,12M,CG-031,DEPOIS DO COMITÊ,,,,,,,,,,,,,,,,,,
AD REFERENDUM,DCT118,30/07/2025,00153.000952/2025-46,SETUR,"Contratação de empresa especializada para prestação de serviços de desenvolvimento de plataforma de turismo, compreendendo o fornecimento de serviços de suporte técnico, sustentação, manutenção corretiva, manutenção preventiva, manutenção perfectiva e manutenção evolutiva",SISTEMA,Novo Sistema / ETIPI,Contratação Direta (Dispensa) - ETIPI,"R$ 1.559.558,00",MÁRCIO (SIA),CONCLUÍDO,ACIMA 600 MIL,PRÓXIMA (A CONFIRMAR),APROVADO,,,#N/A,,Contratação de Pessoa Jurídica,12M,CG-105,DEPOIS DO COMITÊ,,,,,,,,,,,,,,,,,,
,DCT120,01/08/2025,00089.012178/2025-37,UESPI,"Aquisição de licenças do Google Workspace for Education Plus, juntamente com serviço de suporte técnico, para alunos e professores.",SISTEMA,Sistema Existente/ Licença,Adesão à Ata de Registro de Preços,"R$ 1.155.036,00",MÁRCIO (SIA),CONCLUÍDO,ACIMA 600 MIL,"PRÓXIMA (A CONFIRMAR), 14/10/2025",ACIMA DE 600 MIL - DETALHAR INFORMAÇÕES E REAPRESENTAR NO CONSELHO,,,#N/A,,Contratação de Pessoa Jurídica,36M,CG-007,DEPOIS DO COMITÊ,,,,,,,,,,,,,,,,,,
Enviado para deliberação,DCT121,04/08/2025,00027.004478/2025-77,SSP,"Contratação de serviços para aplicação das etapas iniciais do processo de KDD, com o objetivo de aprimorar a infraestrutura de dados da SSP-PI, por meio de auditoria automatizada, tratamento e transformação de dados, e desenvolvimento de interface interativa para visualização e validação das modificações realizadas.",CONSULTORIA E SERVIÇOS DE TIC,Consultoria / Inteligência Artificial,Contratação Direta (Dispensa) - FADEX,"R$ 510.000,00",EQUIPE (SIA),CONCLUÍDO,ABAIXO DE 600 MIL,NÃO SE APLICA,AINDA NÃO SUBMETIDO,,,#N/A,,FADEX,12M,CG-171,DEPOIS DO COMITÊ,,,,,,,,,,,,,,,,,,
Enviado para deliberação,DCT122,06/08/2025,00002.004512/2024-19,SEAD,Aquisição de equipamentos de informática para o Instituto Presente por meio de emenda parlamentar,INFRAESTRUTURA E EQUIPAMENTOS DE TIC,Equipamentos de TIC,Adesão à Ata de Registro de Preços,"R$ 31.213,32",ETIPI,NÃO INICIADO,ABAIXO DE 600 MIL,NÃO SE APLICA,AINDA NÃO SUBMETIDO,,,#N/A,,Contratação de Pessoa Jurídica,12M,CG-083,DEPOIS DO COMITÊ,,,,,,,,,,,,,,,,,,
AD REFERENDUM,DCT126,18/08/2025,00011.039681/2025-33,SEDUC,"Contratação para o desenvolvimento e a implementação de solução tecnológica que viabilize o acompanhamento de áreas fundamentais ao desenvolvimento infantil, tais como saúde, educação, assistência social e família, além da composição de equipe de apoio técnico especializada, ação estratégia essencial para integrar e otimizar o monitoramento das ações do Pacto pela Educação. ",SISTEMA,Novo Sistema / Licença,Contratação Direta (Dispensa) - ETIPI,"R$ 14.390.400,00",MÁRCIO (SIA),CONCLUÍDO,ACIMA 600 MIL,PRÓXIMA (A CONFIRMAR),APROVADO,,,#N/A,,ETIPI,12M,CG-037,DEPOIS DO COMITÊ,,,,,,,,,,,,,,,,,,
AD REFERENDUM,DCT124,18/08/2025,00017.001767/2025-33,SEPLAN,"Abertura de procedimento licitatório para registro de preços para eventual fornecimento de equipamentos de informática e audivisuais para atender as necessidades da Secretaria Estadual de Saúde do Piauí (SESAPI), da Secretaria Estadual da Assistência Social, Trabalho e Direitos Humanos do Piauí (SASC) e da Secretaria de Estado do Planejamento do Piauí (SEPLAN/PI) no âmbito do Projeto Piauí Pilares de Desenvolvimento Humano (PDH).",INFRAESTRUTURA E EQUIPAMENTOS DE TIC,Equipamentos de TIC,"Operação de Crédito (BID, BIRD, etc)","R$ 10.960.328,62",SEAD,CONCLUÍDO,ACIMA 600 MIL,PRÓXIMA (A CONFIRMAR),APROVADO,,,#N/A,,Contratação de Pessoa Jurídica,12M,CG-081,DEPOIS DO COMITÊ,,,,,,,,,,,,,,,,,,
,DCT123,18/08/2025,00009.003202/2025-90,SEFAZ,"Prestação de serviços de manutenção programada preventiva e manutenção corretiva dos componentes do Data Center (Sala Cofre) da Secretaria da Fazenda do Estado do Piauí – SEFAZ/PI, incluindo mão de obra e todo o material necessário para a execução do serviço",CONSULTORIA E SERVIÇOS DE TIC,Serviços / Outros Serviços Especializados,Pregão Eletrônico,"R$ 911.664,54",MÁRCIO (SIA),CONCLUÍDO,ACIMA 600 MIL,14/10/2025,APROVADO,,,,,Contratação de Pessoa Jurídica,12M,CG-081,DEPOIS DO COMITÊ,,,,,,,,,,,,,,,,,,
PROCESSO NÃO DISTRIBUIDO - DEVE SER DISCUTIDO INTERNAMENTE O SEGUIMENTO ,DCT127,28/08/2025,00071.002732/2025-67,INTERPI,"Fornecimento de 12 (doze) licenças de uso da solução de Inteligência Artificial ChatGPT, versão GPT-4.0 – plano Teams/Business, com vigência de 12 (doze) meses consecutivos, incluindo suporte técnico, acesso à API, atualizações automáticas da plataforma e gerenciamento centralizado de usuários.",SISTEMA,Sistema Existente/ Licença,Contratação Direta (Dispensa),"R$ 21.600,00",NÃO SE APLICA,NÃO INICIADO,ABAIXO DE 600 MIL,NÃO SE APLICA,AINDA NÃO SUBMETIDO,,,#N/A,,Contratação de Pessoa Jurídica,12M,CG-081,DEPOIS DO COMITÊ,,,,,,,,,,,,,,,,,,
Enviado para deliberação,DCT128,28/08/2025,00071.004120/2025-17,INTERPI,"Contratação de Empresa Especializada na disponibilização da assinatura da ferramenta de pesquisa e comparação de preços praticados pela Administração Pública, denominada Banco de Preços, que consiste num sistema de pesquisas baseado em resultados de licitações adjudicadas e homologadas, visando facilitar a pesquisa de mercado para estimar os custos das contratações do INTERPI, por um período de 12 (doze) meses.",SISTEMA,Sistema Existente/ Assinatura,Contratação Direta (Inexigibilidade),"R$ 12.300,00",MÁRCIO (SIA),CONCLUÍDO,ABAIXO DE 600 MIL,NÃO SE APLICA,AINDA NÃO SUBMETIDO,,,#N/A,,Contratação de Pessoa Jurídica,12M,CG-059,DEPOIS DO COMITÊ,,,,,,,,,,,,,,,,,,
,DCT129,01/09/2025,00027.006243/2025-10,SSP,Aquisição de equipamentos eletrônicos para montagem de kit VIGIA,INFRAESTRUTURA E EQUIPAMENTOS DE TIC,Outros Equipamentos,Contratação Direta (Dispensa),"R$ 53.177,25",EQUIPE (SIA),CONCLUÍDO,ABAIXO DE 600 MIL,NÃO SE APLICA,APROVADO,,,#N/A,,Contratação de Pessoa Jurídica,12M,CG-171,DEPOIS DO COMITÊ,,,,,,,,,,,,,,,,,,
,DCT130,09/09/2025,00027.005681/2025-61,SSP,"Contratação de empresa para o desenvolvimento de solução com o objetivo de aprofundar a análise dos indicadores de suicídio no Estado do Piauí, reconhecendo a importância das metodologias distintas de suas fontes de dados para uma compreensão mais completa do fenômeno do suicídio. (FADEX)",SISTEMA,Novo Sistema / Contratação de Pessoa Jurídica,Contratação Direta (Dispensa) - FADEX,"R$ 650.000,00",EQUIPE (SIA),CONCLUÍDO,ACIMA 600 MIL,14/10/2025,APROVADO,,,,,FADEX,12M,CG-171,DEPOIS DO COMITÊ,,,,,,,,,,,,,,,,,,
,DCT132,11/09/2025,00031.000452/2025-91,JUCEPI,"Contratação de serviços técnicos especializados, por inexigibilidade de licitação, para manutenção, evolução e suporte de solução SaaS (SIGFácil), visando à continuidade e aprimoramento do sistema integrador da REDESIM no Piauí.",SISTEMA,Sistema Existente / Contratação de Pessoa Jurídica,Contratação Direta (Inexigibilidade),"R$ 3.539.000,00",MÁRCIO (SIA),CONCLUÍDO,ACIMA 600 MIL,14/10/2025,APROVADO,,,#N/A,,Contratação de Pessoa Jurídica,12M,CG-084,DEPOIS DO COMITÊ,,,,,,,,,,,,,,,,,,
,DCT131,11/09/2025,00030.022393/2025-11,DETRAN,"Renovação do contrato nº 44/2022 – detran/pi. este contrato abrange serviços técnicos especializados de tecnologia da informação (ti) para desenvolvimento, manutenção, evolução de sistemas, treinamento, licença de uso de plataforma e equipamentos de ti sob demanda.",SISTEMA,Sistema Existente / Contratação de Pessoa Jurídica,Não se aplica (Renovação),"R$ 2.160.000,00",SEAD,CONCLUÍDO,ACIMA 600 MIL,14/10/2025,APROVADO,,,#N/A,,Contratação de Pessoa Jurídica,12M,CG-005,DEPOIS DO COMITÊ,,,,,,,,,,,,,,,,,,
,DCT133,15/09/2025,00027.007801/2025-64,SSP,"Contratação de solução completa de Data Lakehouse como Serviço (Data Lakehouse as a Service), de natureza contínua.",SISTEMA,Banco de Dados,Contratação Direta (Dispensa) - ETIPI,"R$ 2.060.013,00",MÁRCIO (SIA),CONCLUÍDO,ACIMA 600 MIL,14/10/2025,APROVADO,,,#N/A,,ETIPI,24M,CG-171,DEPOIS DO COMITÊ,,,,,,,,,,,,,,,,,,
,DCT134,23/09/2025,00012.045001/2025-19,SESAPI,"Aquisição de equipamentos de Tecnologia da Informação, compreendendo: Computadores Desktop, Notebooks, Tablets, Nobreaks, Impressoras de Etiquetas, Impressoras de Pulseiras e Leitores de Código de Barras, com o objetivo de atender às demandas do parque tecnológico da Secretaria de Estado da Saúde do Piauí – SESAPI, em especial das unidades hospitalares da capital",INFRAESTRUTURA E EQUIPAMENTOS DE TIC,Equipamentos de TIC,"Operação de Crédito (BID, BIRD, etc)","R$ 10.184.739,00",MÁRCIO (SIA),CONCLUÍDO,ACIMA 600 MIL,14/10/2025,APROVADO,,,#N/A,,Contratação de Pessoa Jurídica,ÚNICA,CG-111,DEPOIS DO COMITÊ,,,,,,,,,,,,,,,,,,
,DCT135,08/10/2025,00027.004395/2025-88,SSP,Contratação de equipamentos de Tecnologia da Informação (TI),INFRAESTRUTURA E EQUIPAMENTOS DE TIC,Equipamentos de TIC,Adesão à Ata de Registro de Preços,"R$ 3.333.300,00",EQUIPE (SIA),CONCLUÍDO,ACIMA 600 MIL,14/10/2025,APROVADO,,,#N/A,,Contratação de Pessoa Jurídica,ÚNICA,CG-171,DEPOIS DO COMITÊ,,,,,,,,,,,,,,,,,,
,DCT136,10/10/2025,00089.020442/2024-25,UESPI,"Contratação, pelo período de 36 (trinta e seis) meses, de licenças temporárias para acesso on-line e off-line à plataforma de acervo digital da Minha Biblioteca LTDA., contendo aproximadamente 15.000 títulos de e-books de diversas editoras e selos editoriais, com acesso multiusuário e simultâneo",SISTEMA,Sistema Existente/ Licença,Contratação Direta (Inexigibilidade),"R$ 909.909,00",ETIPI,CONCLUÍDO,ACIMA 600 MIL,"PRÓXIMA (A CONFIRMAR), 14/10/2025",ACIMA DE 600 MIL - DETALHAR INFORMAÇÕES E REAPRESENTAR NO CONSELHO,,,,,Contratação de Pessoa Jurídica,36M,CG-007,DEPOIS DO COMITÊ,,,,,,,,,,,,,,,,,,
Enviado para deliberação,DCT137,10/10/2025,00027.000223/2025-35,SSP,"equipamentos tecnológicos destinados à modernização da infraestrutura de comunicação da Secretaria de Segurança Pública do Estado do Piauí, visando a otimização da realização de reuniões, videoconferências e atividades administrativas. A medida busca ampliar a eficiência operacional, facilitar a integração entre unidades e promover uma gestão mais eficaz dos recursos públicos.",INFRAESTRUTURA E EQUIPAMENTOS DE TIC,Equipamentos de TIC,Pregão Eletrônico,"R$ 63.000,00",EQUIPE (SIA),CONCLUÍDO,ABAIXO DE 600 MIL,NÃO SE APLICA,APROVADO,,,#N/A,,Contratação de Pessoa Jurídica,ÚNICA,CG-171,DEPOIS DO COMITÊ,,,,,,,,,,,,,,,,,,
Enviado para deliberação,DCT138,13/10/2025,00089.021702/2025-61,UESPI,"Aquisição de equipamentos de tecnologia da informação, mediante adesão à Ata de Registro de Preços nº 06/2025, oriunda do Pregão Eletrônico nº 90126/2024",INFRAESTRUTURA E EQUIPAMENTOS DE TIC,Equipamentos de TIC,Adesão à Ata de Registro de Preços,"R$ 265.250,00",SEAD,CONCLUÍDO,ABAIXO DE 600 MIL,NÃO SE APLICA,AINDA NÃO SUBMETIDO,,,#N/A,,Contratação de Pessoa Jurídica,ÚNICA,CG-007,DEPOIS DO COMITÊ,,,,,,,,,,,,,,,,,,
AD REFERENDUM,DCT139,14/10/2025,00027.006071/2025-84,SSP,Contratação de gestão e manutenção de links de comunicação de dados para interligar 629 Pontos de Captura de Imagens (PCIs) e 2 Centros de Comando e Controle (CCOs) do Projeto de Videomonitoramento Urbano da Secretaria de Segurança Pública do Piauí (SSP/PI) em Teresina e Parnaíba. (ETIPI),INFRAESTRUTURA E EQUIPAMENTOS DE TIC,Comunicação de dados,Contratação Direta (Dispensa) - ETIPI,"R$ 5.873.227,06",MÁRCIO (SIA),CONCLUÍDO,ACIMA 600 MIL,"PRÓXIMA (A CONFIRMAR), 14/10/2025",APROVADO,,,#N/A,,ETIPI,12M,CG-171,DEPOIS DO COMITÊ,,,,,,,,,,,,,,,,,,
Falta aprovar no processo - aprovação parcial. Ver texto com Gratty e Andre ,DCT141,15/10/2025,00030.028544/2025-45,DETRAN,"Contratação de empresa especializada para a prestação de serviços de produção e personalização de Carteira Nacional de Habilitação - CNH e Permissão Internacional para Dirigir – PID e, coleta biométrica dos usuários do sistema RENACH",CONSULTORIA E SERVIÇOS DE TIC,Serviços / Outros Serviços Especializados,Pregão Eletrônico,"R$ 32.737.099,00",SEAD,CONCLUÍDO,ACIMA 600 MIL,PRÓXIMA (A CONFIRMAR),AINDA NÃO SUBMETIDO,,,,,Contratação de Pessoa Jurídica,12M,CG-005,DEPOIS DO COMITÊ,,,,,,,,,,,,,,,,,,
,DCT143,16/10/2025,00010.007865/2025-44,SEGOV,"Contratação de equipe de desenvolvimento, implantação e suporte de um Sistema Web de Gestão de Processos da CGFR (SGP-CGFR) integrado ao SEI-PI para gestão automática de processos e geração de atas, pareceres e despachos.",SISTEMA,Novo Sistema / ETIPI,Contratação Direta (Dispensa) - ETIPI,"R$ 580.000,00",MÁRCIO (SIA),CONCLUÍDO,ABAIXO DE 600 MIL,NÃO SE APLICA,AINDA NÃO SUBMETIDO,,,,,ETIPI,12M,CG-083,DEPOIS DO COMITÊ,,,,,,,,,,,,,,,,,,
"Atualizar ficha, processo foi reenviado",DCT142,16/10/2025,00321.010108/2024-63,CBMEPI,"Contratação de empresa especializada na prestação de serviços de locação de impressoras multifuncionais, impressão outsourcing e cópias, com fornecimento de equipamentos, sistema de gerenciamento de impressões efetivamente realizadas, manutenção preventiva e corretiva dos equipamentos com substituição de peças, componentes, materiais utilizados na manutenção e fornecimento de insumos, exceto papel A4",CONSULTORIA E SERVIÇOS DE TIC,Serviços / Outsourcing de Impressão,Contratação Direta (Dispensa) - ETIPI,"R$ 147.600,00",MÁRCIO (SIA),CONCLUÍDO,ABAIXO DE 600 MIL,NÃO SE APLICA,AINDA NÃO SUBMETIDO,,,,,ETIPI,12M,CG-171,DEPOIS DO COMITÊ,,,,,,,,,,,,,,,,,,
AD REFERENDUM,DCT144,21/10/2025,00040.001203/2025-11,IASPI,"contratação dos serviços de desenvolvimento, implantação e evolução de nova solução tecnológica integrada e modular para a gestão da assistência à saúde do Instituto de Assistência à Saúde dos Servidores Públicos do Estado do Piauí – Iaspi, incluindo a manutenção, suporte técnico e operação dos sistemas legados",SISTEMA,Novo Sistema / ETIPI,Contratação Direta (Dispensa) - ETIPI,"R$ 10.552.316,44",SEAD,CONCLUÍDO,ACIMA 600 MIL,PRÓXIMA (A CONFIRMAR),APROVADO,,,#N/A,,ETIPI,12M,CG-083,DEPOIS DO COMITÊ,,,,,,,,,,,,,,,,,,
,DCT145,21/10/2025,00030.004197/2024-84,DETRAN,"locação de impressoras e multifuncionais, por meio de uma solução de impressão departamental (outsourcing), incluindo a prestação de serviços de manutenção preventiva e corretiva, além do fornecimento de peças e suprimentos necessários (exceto papel) para atender as necessidades do Departamento Estadual de Trânsito do Piauí - DETRAN/PI.",CONSULTORIA E SERVIÇOS DE TIC,Serviços / Outsourcing de Impressão,Contratação Direta (Dispensa) - ETIPI,"R$ 855.360,00",ETIPI,EM ANDAMENTO,ACIMA 600 MIL,PRÓXIMA (A CONFIRMAR),APROVADO,,,,,ETIPI,12M,CG-005,DEPOIS DO COMITÊ,,,,,,,,,,,,,,,,,,
,DCT146,28/10/2025,00012.034797/2025-76,SESAPI,"C, contemplando os módulos RIS (Radiology Information System), PACS (Picture Archiving and Communication System) e Anatomia Patológica, integrada ao sistema de gestão hospitalar MV Soul, com o objetivo de informatizar e otimizar os fluxos de diagnóstico por imagem e anatomopatológico nas unidades hospitalares da rede estadual do Piauí",SISTEMA,Sistema Existente / Contratação de Pessoa Jurídica,Contratação Direta (Inexigibilidade),"R$ 1.044.396,00",MÁRCIO (SIA),CONCLUÍDO,ACIMA 600 MIL,PRÓXIMA (A CONFIRMAR),AINDA NÃO SUBMETIDO,,,,,Contratação de Pessoa Jurídica,12M,CG-111,DEPOIS DO COMITÊ,,,,,,,,,,,,,,,,,,
AD REFERENDUM,DCT147,03/11/2025,00027.003964/2025-78,SSP,"Contratação de solução tecnológica integrada para o Instituto de Cidadania Digital Félix Pacheco (ICDFP), visando à execução de solução tecnológica integrada destinada ao aperfeiçoamento dos recursos de identificação civil e criminal, com o objetivo de modernizar, ampliar e garantir maior eficiência no processo de emissão da Carteira de Identidade Nacional (CIN), Identidades Funcionais (IF) e serviços correlatos, conforme especificações constantes neste Termo de Referência.",SISTEMA,Novo Sistema / ETIPI,Contratação Direta (Dispensa) - ETIPI,"R$ 37.685.200,00",EQUIPE (SIA),CONCLUÍDO,ACIMA 600 MIL,PRÓXIMA (A CONFIRMAR),APROVADO,,,,,Contratação de Pessoa Jurídica,12M,CG-171,DEPOIS DO COMITÊ,,,,,,,,,,,,,,,,,,
,DCT148,04/11/2025,00010.005837/2025-92,SEGOV,Contratação de empresa para o fornecimento de link via satélite de baixa órbita (LEO),INFRAESTRUTURA E EQUIPAMENTOS DE TIC,Comunicação de dados,Contratação Direta (Dispensa) - ETIPI,"R$ 720.000,00",ETIPI,CONCLUÍDO,ACIMA 600 MIL,PRÓXIMA (A CONFIRMAR),AINDA NÃO SUBMETIDO,,,#N/A,,ETIPI,24M,CG-083,DEPOIS DO COMITÊ,,,,,,,,,,,,,,,,,,
,DCT149,05/11/2025,00012.027842/2025-36,SESAPI,"Contratação de solução tecnológica integrada para consultas médicas, com licenciamento permanente da plataforma digital para o Estado do Piauí, visando fornecimento de plataforma digital para telemonitoramento de pacientes, além de suporte técnico remoto à plataforma e consultas, com o objetivo de detectar precocemente e disponibilizar tratamento eficaz para pacientes com suspeita ou diagnóstico de Câncer de Pulmão (CP) e Câncer Colorretal (CCR) para os Estabelecimentos Assistenciais de Saúde nos 12 Territórios do Estado do Piauí.",SISTEMA,Novo Sistema / Contratação de Pessoa Jurídica,Pregão Eletrônico,"R$ 26.076.000,00",MÁRCIO (SIA),CONCLUÍDO,ACIMA 600 MIL,PRÓXIMA (A CONFIRMAR),AINDA NÃO SUBMETIDO,,,#N/A,,Contratação de Pessoa Jurídica,36M,CG-111,DEPOIS DO COMITÊ,,,,,,,,,,,,,,,,,,
AD REFERENDUM,DCT150,09/11/2025,00011.045557/2025-15,SEDUC,Contratação de empresa especializada na prestação de serviços de gerenciamento de computação em nuvem - USN e UST.,CONSULTORIA E SERVIÇOS DE TIC,Serviços / Nuvem,Adesão à Ata de Registro de Preços,"R$ 1.594.954,24",ETIPI,CONCLUÍDO,ACIMA 600 MIL,PRÓXIMA (A CONFIRMAR),APROVADO,,,#N/A,,Contratação de Pessoa Jurídica,12M,CG-083,DEPOIS DO COMITÊ,,,,,,,,,,,,,,,,,,
